LLM-Driven MDA Pipeline for Generating UML Class Diagrams and Code,Z. Babaalla; A. Jakimi; M. Oualla,"Software Engineering and Information Systems Engineering (GL-ISI) Team, Faculty of Sciences and Techniques of Errachidia (FSTE), University of Moulay Ismail (UMI), Meknes, Morocco; Software Engineering and Information Systems Engineering (GL-ISI) Team, Faculty of Sciences and Techniques of Errachidia (FSTE), University of Moulay Ismail (UMI), Meknes, Morocco; Software Engineering and Information Systems Engineering (GL-ISI) Team, Faculty of Sciences and Techniques of Errachidia (FSTE), University of Moulay Ismail (UMI), Meknes, Morocco",IEEE Access,6 Oct 2025,2025,13,,171266,171286,"The transformation of textual specifications into formal software models is a major challenge in software design automation. This study presents an integrated approach that combines the natural language interpretation capabilities of transformer models with explicit concept structuring using a domain specific language (DSL). This DSL, designed as a pivotal intermediate layer, ensures continuity between semantic extraction, UML modeling, and automatic Python code generation. By following the model-driven architecture (MDA) paradigm, the proposed pipeline follows a structured progression from text to model to code while maintaining a high level of traceability and controllability. The experimental evaluation conducted on a dedicated annotated corpus demonstrates the accuracy of the models on UML entities and highlights the importance of DSL for validation, editing, and exploitation of results. This approach paves the way for the development of intelligent modeling tools and structuring of automated transformation chains.",2169-3536,,10.1109/ACCESS.2025.3615828,,https://ieeexplore.ieee.org/stamp/stamp.jsp?arnumber=11184520,Class diagram;UML;MDA;DSL;LLMs;NLP;IOB annotation;source code,Unified modeling language;Object oriented modeling;DSL;Codes;Software;Natural languages;Pipelines;Transformers;Context modeling;Adaptation models,,,,59.0,CCBYNCND,29 Sep 2025,,,IEEE,IEEE Journals
Towards LLM-Assisted HDL Generation and Verification,R. Al Amin; M. G. R. Lincoln; R. Obermaisser,"Institute for Embedded Systems, University of Siegen, Siegen, Germany; Institute for Embedded Systems, University of Siegen, Siegen, Germany; Institute for Embedded Systems, University of Siegen, Siegen, Germany",2025 14th Mediterranean Conference on Embedded Computing (MECO),27 Jun 2025,2025,,,1,5,"The rapid advancement of Large Language Models (LLMs) across various application domains has led to their increasing adoption in Electronic Design Automation (EDA). LLM-assisted hardware design, particularly in HDL (Hardware Description Language) generation and verification, is gaining significant traction in industry and academia. The hardware design process begins with generating and verifying HDL code, which remains a challenging and error-prone task. While recent research has made notable progress in leveraging LLMs for HDL generation (e.g., Verilog and VHDL), existing models still struggle with accuracy. Moreover, a lack of publicly available datasets and open-source evaluation frameworks, particularly for VHDL, limits further advancements in this domain. This paper presents an automated HDL generation and verification system utilizing CodeLlama-7B Instruct with Parameter-Efficient Fine-Tuning (PEFT) methods to address these challenges. Additionally, a multi-granularity VHDL dataset has been developed, incorporating a Pyramid of Thought (PoT) architecture to enhance the efficiency of HDL generation and verification. The proposed LLM model is evaluated using the VerilogEval framework for generated Verilog code and a human evaluation process for VHDL code. The results demonstrate promising performance, achieving up to 63% accuracy with Pass@10 for Verilog and 52% with Pass@10 for VHDL. These findings and the developed VHDL dataset contribute to advancing automatic HDL generation and verification, facilitating further research in EDA and AI-assisted hardware design.",2637-9511,979-8-3315-1341-2,10.1109/MECO66322.2025.11049176,,https://ieeexplore.ieee.org/stamp/stamp.jsp?arnumber=11049176,LLM;hardware design;HDL generation and verification,Industries;Embedded computing;VHDL;Codes;Accuracy;Design automation;Large language models;Computer architecture;Hardware,,,,24.0,IEEE,27 Jun 2025,,,IEEE,IEEE Conferences
LLM-based and Retrieval-Augmented Control Code Generation,H. Koziolek; S. Grüner; R. Hark; V. Ashiwal; S. Linsbauer; N. Eskandani,"ABB Corporate Research, Germany; ABB Corporate Research, Germany; ABB Corporate Research, Germany; ABB Corporate Research, Germany; ABB Corporate Research, Germany; ABB Corporate Research, Germany",2024 IEEE/ACM International Workshop on Large Language Models for Code (LLM4Code),30 Oct 2024,2024,,,22,29,"Control code is designed and implemented for industrial automation applications that manage power plants, petrochemical processes, or steel production. Popular large language models (LLM) can synthesize low-level control code in the Structured Text programming notation according to the standard IEC 61131-3, but are not aware of proprietary control code function block libraries, which are often used in practice. To automate control logic implementation tasks, we proposed a retrieval-augmented control code generation method that can integrate such function blocks into the generated code. With this method control engineers can benefit from the code generation capabilities of LLMs, re-use proprietary and well-tested function blocks, and speed up typical programming tasks significantly. We have evaluated the method using a prototypical implementation based on GPT-4, LangChain, Open-PLC, and the open-source OSCAT function block library. In several spot sample tests, we successfully generated IEC 61131-3 ST code that integrated the desired function blocks, could be compiled, and validated through simulations.CCS CONCEPTS• Software and its engineering Automatic programming; Command and control languages; • Applied computing → Computer-aided design; • Computing methodologies → Natural language processing.",,979-8-4007-0579-3,,,https://ieeexplore.ieee.org/stamp/stamp.jsp?arnumber=10734438,Large language models;code generation;IEC 61131-3;industrial automation;PLC;DCS;ChatGPT;GPT-4,Codes;Automation;Large language models;Process control;Libraries;Vectors;Logic;IEC Standards;Programming environments;Testing,,10.0,,29.0,,30 Oct 2024,,,IEEE,IEEE Conferences
VGV: Verilog Generation using Visual Capabilities of Multi-Modal Large Language Models,S. -Z. Wong; G. -W. Wan; D. Liu; X. Wang,"National Center of Technology, Innovation for EDA, Nanjing, Jiangsu, China; National Center of Technology, Innovation for EDA, Nanjing, Jiangsu, China; Amazon Web Services, Amazon China, Shenzhen, Guangdong, China; School of Integrated Circuit, Southeast University, Nanjing, Jiangsu, China",2024 IEEE LLM Aided Design Workshop (LAD),1 Oct 2024,2024,,,1,5,"This paper investigates the use of multimodal large language models (MMLLMs) for generating Verilog code from visual inputs, addressing the challenge of describing complex system architectures. It explores the potential of these models to map visual information from circuit diagrams to Verilog, due to the lack of standardized microarchitecture diagrams in the industry. A difficulty-graded benchmark is introduced to test the LLMs’ generative capabilities. Additionally, the study proposes “Thinking Vision,” a novel visual acquisition method for RTL generation, which has significantly enhanced success rates in open-source multimodal models by over 50%. The paper concludes with an evaluation of multimodal LLMs’ performance and suggestions for improving visual processing capabilities for complex architectures.",,979-8-3503-7608-1,10.1109/LAD62341.2024.10691753,,https://ieeexplore.ieee.org/stamp/stamp.jsp?arnumber=10691753,,Industries;Visualization;Microarchitecture;Codes;Large language models;Conferences;Benchmark testing;Hardware design languages;Integrated circuit modeling;Complex systems,,3.0,,15.0,IEEE,1 Oct 2024,,,IEEE,IEEE Conferences
"Speculative Decoding for Verilog: Speed and Quality, All in One",C. Xu; Y. Liu; Y. Zhou; S. Huang; N. Xu; Q. Xu,"The Chinese University of Hong Kong Shatin, Hong Kong, S.A.R; The Chinese University of Hong Kong Shatin, Hong Kong, S.A.R; The Chinese University of Hong Kong Shatin, Hong Kong, S.A.R; Shanghai Jiao Tong University, Shanghai, China; Shanghai Jiao Tong University, Shanghai, China; The Chinese University of Hong Kong Shatin, Hong Kong, S.A.R",2025 62nd ACM/IEEE Design Automation Conference (DAC),15 Sep 2025,2025,,,1,7,"The rapid advancement of large language models (LLMs) has revolutionized code generation tasks across various programming languages. However, the unique characteristics of programming languages, particularly those like Verilog with specific syntax and lower representation in training datasets, pose significant challenges for conventional tokenization and decoding approaches. In this paper, we introduce a novel application of speculative decoding for Verilog code generation, showing that it can improve both inference speed and output quality, effectively achieving speed and quality all in one. Unlike standard LLM tokenization schemes, which often fragment meaningful code structures, our approach aligns decoding stops with syntactically significant tokens, making it easier for models to learn the token distribution. This refinement addresses inherent tokenization issues and enhances the model’s ability to capture Verilog’s logical constructs more effectively. Our experimental results show that our method achieves up to a $5.05 \times$ speedup in Verilog code generation and increases pass@10 functional accuracy on RTLLM by up to $\mathbf{1 7. 1 9 \%}$ compared to conventional training strategies. These findings highlight speculative decoding as a promising approach to bridge the quality gap in code generation for specialized programming languages.",,979-8-3315-0304-8,10.1109/DAC63849.2025.11133030,,https://ieeexplore.ieee.org/stamp/stamp.jsp?arnumber=11133030,Verilog code generation;speculative decoding,Training;Codes;Accuracy;Semantics;Syntactics;Reliability engineering;Tokenization;Decoding;Hardware design languages;Standards,,,,37.0,IEEE,15 Sep 2025,,,IEEE,IEEE Conferences
Training LLMs for Generating IEC 61131-3 Structured Text with Online Feedback,A. Haag; B. Fuchs; A. Kacan; O. Lohse,"Technology Department, Siemens, Munich, Germany; Technology Department, Siemens, Munich, Germany; Technology Department, Siemens, Munich, Germany; Technology Department, Siemens, Munich, Germany",2025 IEEE/ACM International Workshop on Large Language Models for Code (LLM4Code),12 Jun 2025,2025,,,65,71,"IEC 61131-3 Structured Text (ST) is a widely used programming language for programmable logic controllers (PLCs) in automation systems. However, generating ST code with LLMs poses unique challenges due to limited data in public training datasets and the complexity of ST language syntax. This paper proposes an approach to fine-tune LLMs for the generation of ST code that leverages a preference-based learning method through an online process involving compiler feedback and evaluation from an LLM-based ST expert. In this framework, the model is iteratively refined and generates new training samples, which are subsequently evaluated by a compiler for syntactical correctness and by a specialized LLM that excels at assessing semantic accuracy, though it is not optimized for code generation itself. This approach results in marked improvements for the trained LLM, leading to higher compilation success rates and better semantic precision. As a result, the framework proves highly suitable for industrial automation applications and outperforms state-of-the-art models.",,979-8-3315-2615-3,10.1109/LLM4Code66737.2025.00013,,https://ieeexplore.ieee.org/stamp/stamp.jsp?arnumber=11028556,IEC 61131-3;LLMs;LLM Fine-tuning;Compiler feedback,Training;Computer languages;Codes;Automation;Semantics;Programmable logic devices;Syntactics;Iterative methods;IEC Standards;Synthetic data,,2.0,,38.0,IEEE,12 Jun 2025,,,IEEE,IEEE Conferences
GEMMV: An LLM-Based Automated Performance-Aware Framework for GEMM Verilog Generation,G. Zhang; D. Zou; K. Sun; Z. Chen; M. Wang; Z. Wang,"School of Electronic Science and Engineering, Nanjing University, Nanjing, China; School of Electronic Science and Engineering, Nanjing University, Nanjing, China; School of Integrated Circuits, Shenzhen Campus of Sun Yat-sen University, Shenzhen, China; School of Integrated Circuits, Shenzhen Campus of Sun Yat-sen University, Shenzhen, China; School of Integrated Circuits, Shenzhen Campus of Sun Yat-sen University, Shenzhen, China; School of Electronic Science and Engineering, Nanjing University, Nanjing, China",IEEE Journal on Emerging and Selected Topics in Circuits and Systems,25 Jun 2025,2025,15,2.0,325,336,"Recent advancements in artificial intelligence (AI) models have intensified the need for specialized AI accelerators. The design of optimized general matrix multiplication (GEMM) module tailored for these accelerators is crucial but time-consuming and expertise-demanding, creating a demand for automating design processes. Large language models (LLMs), capable of generating high-quality designs from human instructions, show great promise in automating GEMM module creation. However, the GEMM module’s vast design space and stringent performance requirements, along with the limitations of datasets and the lack of hardware performance awareness of LLMs, have made previous LLM-based register transfer level (RTL) code generation efforts unsuitable for GEMM design. To tackle these challenges, this paper proposes an automated performance-aware LLM-based framework, GEMMV, for generating high-correctness and high-performance Verilog code for GEMM. This framework utilizes in-context learning based on GPT-4 to automatically generate high-quality and well-annotated Verilog code for different variants of the GEMM. Additionally, it leverages in-context learning to obtain performance awareness by integrating a multi-level performance model (MLPM) with fine-tuned LLMs. The Verilog code generated by this framework reduces latency by 3.1x and improves syntax correctness by 65% and functionality correctness by 70% compared to earlier efforts.",2156-3365,,10.1109/JETCAS.2025.3568712,National Key Research and Development Program of China(grant numbers:2022YFB4400600); National Natural Science Foundation of China(grant numbers:62404256); Postgraduate Research and Practice Innovation Program of Jiangsu Province(grant numbers:149); Key Project of Shenzhen Basic Research Program(grant numbers:JCYJ20241206180301003); ,https://ieeexplore.ieee.org/stamp/stamp.jsp?arnumber=10994474,AI accelerators;design automation;LLMs;fine-tuning;GEMM,Adders;Hardware design languages;Codes;Hardware;Artificial intelligence;AI accelerators;Register transfer level;Training;Syntactics;Optimization,,,,44.0,IEEE,9 May 2025,,,IEEE,IEEE Journals
Effective Text Adaptation For LLM-Based ASR Through Soft Prompt Fine-Tuning,Y. Ma; Z. Liu; O. Kalinli,"Meta AI, Menlo Park, CA, USA; Meta AI, Menlo Park, CA, USA; Meta AI, Menlo Park, CA, USA",2024 IEEE Spoken Language Technology Workshop (SLT),16 Jan 2025,2024,,,64,69,"The advent of Large Language Models (LLM) has reformed the Automatic Speech Recognition (ASR). Prompting LLM with audio embeddings to generate transcriptions becomes the new state-of-the-art ASR. Despite LLMs being trained with an extensive amount of text corpora, high-quality domain-specific text data can still significantly enhance ASR performance on domain adaptation tasks. Although LLM-based ASR can naturally incorporate more text corpora by fine-tuning the LLM decoder, fine-tuning such ASR on text-only data without paired prompts may diminish the effectiveness of domain-specific knowledge. To mitigate this issue, we propose a two-step soft prompt fine-tuning strategy that enhances domain-specific text adaptation. Experimental results show that text adaptation with our proposed method achieved a relative up to 9% Word Error Rate (WER) reduction and up to 18% Entity Error Rate (EER) reduction on the target domain compared to the baseline ASR. Combining this with domain-specific Language Model (LM) fusion can further improve the EER by a relative 2-5%.",,979-8-3503-9225-8,10.1109/SLT61566.2024.10832227,,https://ieeexplore.ieee.org/stamp/stamp.jsp?arnumber=10832227,Text adaptation;LLM-based ASR;soft prompt,Adaptation models;Error analysis;Large language models;Conferences;Decoding;Domain specific languages;Automatic speech recognition,,1.0,,32.0,IEEE,16 Jan 2025,,,IEEE,IEEE Conferences
RoSum-Mcts: Monte Carlo Tree Search-Inspired HDL Code Summarization with Structural Rewards,P. Vijayaraghavan; C. Mackin; L. Shi; A. Nitsure; A. Jadhav; D. Beymer; T. Baldwin; E. Degan; V. Mukherjee,"IBM Research, San Jose, CA, USA; IBM Research, San Jose, CA, USA; IBM Research, San Jose, CA, USA; IBM Research, San Jose, CA, USA; IBM Research, San Jose, CA, USA; IBM Research, San Jose, CA, USA; IBM Research, San Jose, CA, USA; IBM Research, San Jose, CA, USA; IBM Research, San Jose, CA, USA",2025 IEEE International Conference on LLM-Aided Design (ICLAD),13 Aug 2025,2025,,,156,163,"Large language models (LLMs) have shown promise in code summarization, yet their effectiveness for Hardware Description Languages (HDLs) like VHDL and Verilog remains underexplored. We propose RoSum-Mcts, an LLM-guided approach inspired by Monte Carlo Tree Search (MCTS) that refines summaries through structured exploration and reinforcement-driven optimization. Our method integrates both local and global context via a hierarchical candidate expansion mechanism and optimizes summaries using a composite reward function balancing functional correctness (FC), local content adequacy (LCA), and fluency. We evaluate RoSum-Mcts on the VHDL-eval and Verilog-eval datasets, demonstrating its consistent outperformance over baseline methods by leveraging structured bottom-up refinement and reinforcement-based optimization. Ablation studies confirm the necessity of both local and global expansion strategies, as well as the importance of balancing FC and LCA for optimal performance. Furthermore, RoSum-Mcts proves robust against superficial modifications, such as variable renaming, maintaining summary quality where baselines degrade. These results establish RoSum-Mcts as an effective and robust HDL summarization framework, paving the way for further research into reinforcement-enhanced code summarization.",,979-8-3315-2597-2,10.1109/ICLAD65226.2025.00037,,https://ieeexplore.ieee.org/stamp/stamp.jsp?arnumber=11105991,HDL Code Summarization;MCTS;Monte Carlo Tree Search;LLM;Functional Correctness;Local Content Adequacy;Bottom-up refinement;Verilog;VHDL;AST;Code Explanation;Code Summarization,Codes;Monte Carlo methods;VHDL;Large language models;Refining;Hardware;Optimization;Tuning,,,,27.0,IEEE,13 Aug 2025,,,IEEE,IEEE Conferences
Benchmarking Large Language Models for Automated Verilog RTL Code Generation,S. Thakur; B. Ahmad; Z. Fan; H. Pearce; B. Tan; R. Karri; B. Dolan-Gavitt; S. Garg,New York University; New York University; New York University; New York University; University of Calgary; New York University; New York University; New York University,"2023 Design, Automation & Test in Europe Conference & Exhibition (DATE)",2 Jun 2023,2023,,,1,6,"Automating hardware design could obviate a signif-icant amount of human error from the engineering process and lead to fewer errors. Verilog is a popular hardware description language to model and design digital systems, thus generating Verilog code is a critical first step. Emerging large language models (LLMs) are able to write high-quality code in other programming languages. In this paper, we characterize the ability of LLMs to generate useful Verilog. For this, we fine-tune pre-trained LLMs on Verilog datasets collected from GitHub and Verilog textbooks. We construct an evaluation framework comprising test-benches for functional analysis and a flow to test the syntax of Verilog code generated in response to problems of varying difficulty. Our findings show that across our problem scenarios, the fine-tuning results in LLMs more capable of producing syntactically correct code (25.9% overall). Further, when analyzing functional correctness, a fine-tuned open-source CodeGen LLM can outperform the state-of-the-art commercial Codex LLM (6.5% overall). We release our training/evaluation scripts and LLM checkpoints as open source contributions.",1558-1101,979-8-3503-9624-9,10.23919/DATE56975.2023.10137086,"NSF(grant numbers:1553419,1646671,2039607); ARO(grant numbers:77191NC); ",https://ieeexplore.ieee.org/stamp/stamp.jsp?arnumber=10137086,Transformers;Verilog;GPT;LLM,Codes;Digital systems;Syntactics;Benchmark testing;Transformers;Hardware;Functional analysis,,113.0,,15.0,,2 Jun 2023,,,IEEE,IEEE Conferences
LLM vs HLS for RTL Code Generation: Friend or Foe?,S. Bhattacharyya; S. B. G; C. Karfa,NA; NA; NA,2024 IEEE 33rd Asian Test Symposium (ATS),14 Mar 2025,2024,,,1,6,"High-Level Synthesis (HLS) tools are widely used for the efficient transformations of behavioural code into equivalent hardware in Register Transfer Level (RTL). However, recent studies show that Large Language Models (LLMs) can be used to generate Verilog or equivalent hardware descriptions directly from behavioural descriptions, making LLMs a potential ‘foe’ for HLS. While LLMs can generate RTL code, they lack certain fine aspects like control over design constraints and optimizations and the inability to handle large behavioural designs. In this paper, we show how LLM can be a ‘friend’ of HLS in generating RTL directly from behavioural descriptions. Although HLS tools have matured over the years, making the input code synthesizable, applying correct pragmas and source code optimizations are still manual efforts in the HLS. LLMs can make hardware accelerator design with HLS easier by automating these manual steps. We show that LLMs are efficient in resolving synthesis issues and optimizing course code for HLS. We have used performance to hardware gain to evaluate the LLMs’ performance in optimizing code adhering to resource usage. We perform our experiments on image processing tasks as benchmarks and discuss where LLM can perform well as well as the issues faced by it when trying to maximize the performance to hardware gain.",2377-5386,979-8-3315-2916-1,10.1109/ATS64447.2024.10915452,Semiconductor Research Corporation; ,https://ieeexplore.ieee.org/stamp/stamp.jsp?arnumber=10915452,High Level Synthesis;LLM;RTL,Codes;Image resolution;Source coding;Large language models;Manuals;Streaming media;Register transfer level;Hardware;Space exploration;Optimization,,,,20.0,IEEE,14 Mar 2025,,,IEEE,IEEE Conferences
Beyond Verilog: Agents for Emerging HDLs,F. Rabiei; M. Zakharov; J. Renau,"University of California Santa Cruz Computer Science and Engineering, Santa Cruz, USA; University of California Santa Cruz Computer Science and Engineering, Santa Cruz, USA; University of California Santa Cruz Computer Science and Engineering, Santa Cruz, USA",2025 IEEE International Conference on Omni-layer Intelligent Systems (COINS),22 Aug 2025,2025,,,1,7,"Large Language Models (LLMs) are transforming the programming language landscape, but their effectiveness is limited for niche Hardware Description Languages (HDLs) due to insufficient training data. This paper introduces HDLAgent, an agentic AI framework that enhances LLMs’ proficiency with underrepresented HDLs.Our agent employs two key mechanisms: HDL description summaries that facilitate knowledge transfer from familiar languages like Verilog, and enhanced grounding through compiler error feedback. We demonstrate that HDLAgent significantly improves code generation across multiple HDLs. For example, PyRTL’s functional correctness rate improves from 0% to 35% with Mixtral 8x7B, and Chisel’s success rate increases from 0% to 59% with GPT-3.5-turbo. For small code samples (under 25 lines), HDLAgent achieves over 90% success across all tested HDLs. Beyond performance metrics, we provide insights on scalability limitations with increasing code complexity and propose modifications to HDL designs that could better accommodate LLM-based generation.",2996-5330,979-8-3315-2037-3,10.1109/COINS65080.2025.11125745,Google; ,https://ieeexplore.ieee.org/stamp/stamp.jsp?arnumber=11125745,Large Language Models;Hardware Description Languages;AI-enhanced coding;Code generation;Verilog;PyRTL;Chisel;DSLX,Codes;Grounding;Large language models;Scalability;Training data;Performance metrics;Encoding;Hardware design languages;Intelligent systems;Knowledge transfer,,,,23.0,IEEE,22 Aug 2025,,,IEEE,IEEE Conferences
